name,url,stars,description,license,question_issues,help_wanted_issues,community_score,created_at
ClickHouse/ClickHouse,https://github.com/ClickHouse/ClickHouse,39060,ClickHouse® is a real-time analytics database management system,Apache License 2.0,5081,236,5317,2016-06-02
envoyproxy/envoy,https://github.com/envoyproxy/envoy,25488,Cloud-native high-performance edge/middle/service proxy,Apache License 2.0,2661,1357,4018,2016-08-08
facebookresearch/faiss,https://github.com/facebookresearch/faiss,33069,A library for efficient similarity search and clustering of dense vectors.,The MIT License,747,191,938,2017-02-07
carla-simulator/carla,https://github.com/carla-simulator/carla,12033,Open-source simulator for autonomous driving research.,The MIT License,828,48,876,2017-10-24
microsoft/LightGBM,https://github.com/microsoft/LightGBM,16963,"A fast, distributed, high performance gradient boosting (GBT, GBDT, GBRT, GBM or MART) framework based on decision tree algorithms, used for ranking, classification and many other machine learning tasks.",The MIT License,679,186,865,2016-08-05
swoole/swoole-src,https://github.com/swoole/swoole-src,18577,🚀 Coroutine-based concurrency library for PHP,Apache License 2.0,786,0,786,2012-07-21
microsoft/terminal,https://github.com/microsoft/terminal,97076,"The new Windows Terminal and the original Windows console host, all in the same place!",The MIT License,0,760,760,2017-08-11
rapidsai/cudf,https://github.com/rapidsai/cudf,8687,cuDF - GPU DataFrame Library ,Apache License 2.0,379,0,379,2017-05-07
NVIDIA/TensorRT,https://github.com/NVIDIA/TensorRT,11191,NVIDIA® TensorRT™ is an SDK for high-performance deep learning inference on NVIDIA GPUs. This repository contains the open source components of TensorRT.,Apache License 2.0,336,0,336,2019-05-02
NVIDIA/TensorRT-LLM,https://github.com/NVIDIA/TensorRT-LLM,9438,TensorRT-LLM provides users with an easy-to-use Python API to define Large Language Models (LLMs) and build TensorRT engines that contain state-of-the-art optimizations to perform inference efficiently on NVIDIA GPUs. TensorRT-LLM also contains components to create Python and C++ runtimes that execute those TensorRT engines.,Apache License 2.0,267,6,273,2023-08-16
tesseract-ocr/tesseract,https://github.com/tesseract-ocr/tesseract,64643,Tesseract Open Source OCR Engine (main repository),Apache License 2.0,226,3,229,2014-08-12
skypjack/entt,https://github.com/skypjack/entt,10611,Gaming meets modern C++ - a fast and reliable entity component system (ECS) and much more,The MIT License,206,20,226,2017-03-27
PaddlePaddle/Paddle,https://github.com/PaddlePaddle/Paddle,22472,PArallel Distributed Deep LEarning: Machine Learning Framework from Industrial Practice （『飞桨』核心框架，深度学习&机器学习高性能单机、分布式训练和跨平台部署）,Apache License 2.0,205,0,205,2016-08-15
WasmEdge/WasmEdge,https://github.com/WasmEdge/WasmEdge,8959,"WasmEdge is a lightweight, high-performance, and extensible WebAssembly runtime for cloud native, edge, and decentralized applications. It powers serverless apps, embedded functions, microservices, smart contracts, and IoT devices.",Apache License 2.0,60,98,158,2019-11-29
polybar/polybar,https://github.com/polybar/polybar,14380,A fast and easy-to-use status bar,The MIT License,60,61,121,2016-05-19
taichi-dev/taichi,https://github.com/taichi-dev/taichi,26741,"Productive, portable, and performant GPU programming in Python.",Apache License 2.0,120,0,120,2016-11-24
ggml-org/llama.cpp,https://github.com/ggml-org/llama.cpp,74659,LLM inference in C/C++,The MIT License,34,85,119,2023-03-10
doitsujin/dxvk,https://github.com/doitsujin/dxvk,14049,"Vulkan-based implementation of D3D8, 9, 10 and 11 for Linux / Wine",Zlib/libpng License,96,20,116,2017-10-11
ggerganov/whisper.cpp,https://github.com/ggerganov/whisper.cpp,37849,Port of OpenAI's Whisper model in C/C++,The MIT License,91,16,107,2022-09-25
finos/perspective,https://github.com/finos/perspective,8811,"A data visualization and analytics component, especially well-suited for large and/or streaming datasets.",Apache License 2.0,96,0,96,2017-11-02
abseil/abseil-cpp,https://github.com/abseil/abseil-cpp,15463,Abseil Common Libraries (C++),Apache License 2.0,81,4,85,2017-09-20
alibaba/weex,https://github.com/alibaba/weex,18294,A framework for building Mobile cross-platform UI,Apache License 2.0,0,81,81,2016-03-11
google/benchmark,https://github.com/google/benchmark,9262,A microbenchmark support library,Apache License 2.0,5,66,71,2013-12-12
EOSIO/eos,https://github.com/EOSIO/eos,11280,An open source smart contract platform ,The MIT License,62,4,66,2017-04-05
catboost/catboost,https://github.com/catboost/catboost,8248,"A fast, scalable, high performance Gradient Boosting on Decision Trees library, used for ranking, classification, regression and other machine learning tasks for Python, R, Java, C++. Supports computation on CPU and GPU.",Apache License 2.0,0,59,59,2017-07-18
simdjson/simdjson,https://github.com/simdjson/simdjson,19759,"Parsing gigabytes of JSON per second : used by Facebook/Meta Velox, the Node.js runtime, ClickHouse, WatermelonDB, Apache Doris, Milvus, StarRocks",Apache License 2.0,7,44,51,2018-03-23
dogecoin/dogecoin,https://github.com/dogecoin/dogecoin,14900,very currency,The MIT License,32,19,51,2013-12-06
drogonframework/drogon,https://github.com/drogonframework/drogon,11947,Drogon: A C++14/17/20 based HTTP web application framework running on Linux/macOS/Unix/Windows,The MIT License,44,4,48,2018-04-27
nomic-ai/gpt4all,https://github.com/nomic-ai/gpt4all,72509,GPT4All: Run Local LLMs on Any Device. Open-source and available for commercial use.,The MIT License,39,3,42,2023-03-27
microsoft/calculator,https://github.com/microsoft/calculator,30055,Windows Calculator: A simple yet powerful calculator that ships with Windows,The MIT License,21,21,42,2019-01-28
bpftrace/bpftrace,https://github.com/bpftrace/bpftrace,8924,High-level tracing language for Linux,Apache License 2.0,11,27,38,2018-08-31
ocornut/imgui,https://github.com/ocornut/imgui,63260,Dear ImGui: Bloat-free Graphical User interface for C++ with minimal dependencies,The MIT License,26,11,37,2014-07-21
apache/incubator-weex,https://github.com/apache/incubator-weex,13726,Apache Weex (Incubating),Apache License 2.0,17,19,36,2017-01-06
facebook/hermes,https://github.com/facebook/hermes,10100,A JavaScript engine optimized for running React Native.,The MIT License,29,3,32,2018-10-22
nasa/fprime,https://github.com/nasa/fprime,10174,F´ - A flight software and embedded systems framework,Apache License 2.0,0,23,23,2017-06-22
changkun/modern-cpp-tutorial,https://github.com/changkun/modern-cpp-tutorial,24468,📚 Modern C++ Tutorial: C++11/14/17/20 On the Fly | https://changkun.de/modern-cpp/,The MIT License,14,6,20,2016-08-19
ninja-build/ninja,https://github.com/ninja-build/ninja,11613,a small build system with a focus on speed,Apache License 2.0,0,19,19,2011-02-06
facebook/yoga,https://github.com/facebook/yoga,17470,Yoga is an embeddable layout engine targeting web standards.,The MIT License,16,0,16,2014-04-07
uNetworking/uWebSockets.js,https://github.com/uNetworking/uWebSockets.js,8297,μWebSockets for Node.js back-ends :metal:,Apache License 2.0,6,9,15,2018-07-27
apple/foundationdb,https://github.com/apple/foundationdb,14818,"FoundationDB - the open source, distributed, transactional key-value store",Apache License 2.0,1,13,14,2017-12-14
ossrs/srs,https://github.com/ossrs/srs,26370,"SRS is a simple, high-efficiency, real-time media server supporting RTMP, WebRTC, HLS, HTTP-FLV, HTTP-TS, SRT, MPEG-DASH, and GB28181.",The MIT License,0,13,13,2015-04-29
google/sentencepiece,https://github.com/google/sentencepiece,10601,Unsupervised text tokenizer for Neural Network-based text generation.,Apache License 2.0,0,10,10,2017-03-07
TheAlgorithms/C-Plus-Plus,https://github.com/TheAlgorithms/C-Plus-Plus,31254,"Collection of various algorithms in mathematics, machine learning, computer science and physics implemented in C++ for educational purposes.",The MIT License,4,5,9,2016-07-16
ml-explore/mlx,https://github.com/ml-explore/mlx,19143,MLX: An array framework for Apple silicon,The MIT License,8,1,9,2023-11-28
google/flatbuffers,https://github.com/google/flatbuffers,23779,FlatBuffers: Memory Efficient Serialization Library,Apache License 2.0,0,7,7,2014-05-19
nodegui/nodegui,https://github.com/nodegui/nodegui,8993,A library for building cross-platform native desktop applications with Node.js and CSS  🚀.  React NodeGui : https://react.nodegui.org and Vue NodeGui: https://vue.nodegui.org,The MIT License,6,0,6,2019-05-14
swiftlang/swift,https://github.com/swiftlang/swift,68138,The Swift Programming Language,Apache License 2.0,3,2,5,2015-10-23
ggml-org/ggml,https://github.com/ggml-org/ggml,11884,Tensor library for machine learning,The MIT License,2,3,5,2022-09-18
owasp-modsecurity/ModSecurity,https://github.com/owasp-modsecurity/ModSecurity,8532,"ModSecurity is an open source, cross platform web application firewall (WAF) engine for Apache, IIS and Nginx. It has a robust event-based programming language which provides protection from a range of attacks against web applications and allows for HTTP traffic monitoring, logging and real-time analysis.",Apache License 2.0,0,3,3,2011-02-02
microsoft/wslg,https://github.com/microsoft/wslg,10442,Enabling the Windows Subsystem for Linux to include support for Wayland and X server related scenarios,The MIT License,3,0,3,2021-03-11
ggerganov/kbd-audio,https://github.com/ggerganov/kbd-audio,8627,🎤⌨️ Acoustic keyboard eavesdropping,The MIT License,2,0,2,2018-08-27
apache/brpc,https://github.com/apache/brpc,16772,"brpc is an Industrial-grade RPC framework using C++ Language, which is often used in high performance system such as Search, Storage, Machine learning, Advertisement, Recommendation etc. ""brpc"" means ""better RPC"".",Apache License 2.0,0,2,2,2017-09-04
vesoft-inc/nebula,https://github.com/vesoft-inc/nebula,11050,"  A distributed, fast open-source graph database featuring horizontal scalability and high availability",Apache License 2.0,0,2,2,2018-08-28
aristocratos/btop,https://github.com/aristocratos/btop,23030,A monitor of resources,Apache License 2.0,0,1,1,2021-05-06
facebook/folly,https://github.com/facebook/folly,28990,An open-source C++ library developed and used at Facebook.,Apache License 2.0,1,0,1,2012-06-01
google/filament,https://github.com/google/filament,18140,"Filament is a real-time physically based rendering engine for Android, iOS, Windows, Linux, macOS, and WebGL2",Apache License 2.0,0,1,1,2018-08-03
scylladb/seastar,https://github.com/scylladb/seastar,8538,High performance server-side application framework,Apache License 2.0,0,1,1,2014-08-18
google/guetzli,https://github.com/google/guetzli,12929,Perceptual JPEG encoder,Apache License 2.0,1,0,1,2016-10-21
hoffstadt/DearPyGui,https://github.com/hoffstadt/DearPyGui,13735,Dear PyGui: A fast and powerful Graphical User Interface Toolkit for Python with minimal dependencies,The MIT License,0,1,1,2020-05-28
ApolloAuto/apollo,https://github.com/ApolloAuto/apollo,25507,An open autonomous driving platform,Apache License 2.0,0,0,0,2017-07-04
bitcoin/bitcoin,https://github.com/bitcoin/bitcoin,82066,Bitcoin Core integration/staging tree,The MIT License,0,0,0,2010-12-19
godotengine/godot,https://github.com/godotengine/godot,94094,Godot Engine – Multi-platform 2D and 3D game engine,The MIT License,0,0,0,2014-01-04
nlohmann/json,https://github.com/nlohmann/json,44446,JSON for Modern C++,The MIT License,0,0,0,2013-07-04
opencv/opencv,https://github.com/opencv/opencv,80623,Open Source Computer Vision Library,Apache License 2.0,0,0,0,2012-07-19
grpc/grpc,https://github.com/grpc/grpc,42462,"The C based gRPC (C++, Python, Ruby, Objective-C, PHP, C#)",Apache License 2.0,0,0,0,2014-12-08
tensorflow/tensorflow,https://github.com/tensorflow/tensorflow,188089,An Open Source Machine Learning Framework for Everyone,Apache License 2.0,0,0,0,2015-11-07
facebook/react-native,https://github.com/facebook/react-native,120622,A framework for building native applications using React,The MIT License,0,0,0,2015-01-09
electron/electron,https://github.com/electron/electron,115513,":electron: Build cross-platform desktop apps with JavaScript, HTML, and CSS",The MIT License,0,0,0,2013-04-12
apache/mxnet,https://github.com/apache/mxnet,20787,"Lightweight, Portable, Flexible Distributed/Mobile Deep Learning with Dynamic, Mutation-aware Dataflow Dep Scheduler; for Python, R, Julia, Scala, Go, Javascript and more",Apache License 2.0,0,0,0,2015-04-30
barry-ran/QtScrcpy,https://github.com/barry-ran/QtScrcpy,22623,Android real-time display control software,Apache License 2.0,0,0,0,2019-06-23
microsoft/winget-cli,https://github.com/microsoft/winget-cli,23817,"WinGet is the Windows Package Manager. This project includes a CLI (Command Line Interface), PowerShell modules, and a COM (Component Object Model) API (Application Programming Interface).",The MIT License,0,0,0,2019-07-16
google-ai-edge/mediapipe,https://github.com/google-ai-edge/mediapipe,28614,"Cross-platform, customizable ML solutions for live and streaming media.",Apache License 2.0,0,0,0,2019-06-13
duckdb/duckdb,https://github.com/duckdb/duckdb,26564,DuckDB is an analytical in-process SQL database management system,The MIT License,0,0,0,2018-06-26
dmlc/xgboost,https://github.com/dmlc/xgboost,26599,"Scalable, Portable and Distributed Gradient Boosting (GBDT, GBRT or GBM) Library,  for Python, R, Java, Scala, C++ and more. Runs on single machine, Hadoop, Spark, Dask, Flink and DataFlow",Apache License 2.0,0,0,0,2014-02-06
cmderdev/cmder,https://github.com/cmderdev/cmder,26179,Lovely console emulator package for Windows,The MIT License,0,0,0,2013-07-09
yhirose/cpp-httplib,https://github.com/yhirose/cpp-httplib,13716,A C++ header-only HTTP/HTTPS server and client library,The MIT License,0,0,0,2012-09-22
microsoft/IoT-For-Beginners,https://github.com/microsoft/IoT-For-Beginners,15605,"12 Weeks, 24 Lessons, IoT for All!",The MIT License,0,0,0,2021-03-03
google/libphonenumber,https://github.com/google/libphonenumber,16982,"Google's common Java, C++ and JavaScript library for parsing, formatting, and validating international phone numbers.",Apache License 2.0,0,0,0,2014-12-03
uNetworking/uWebSockets,https://github.com/uNetworking/uWebSockets,17680,"Simple, secure & standards compliant web server for the most demanding of applications",Apache License 2.0,0,0,0,2016-03-21
qinguoyi/TinyWebServer,https://github.com/qinguoyi/TinyWebServer,17420,:fire: Linux下C++轻量级WebServer服务器,Apache License 2.0,0,0,0,2019-05-29
apache/arrow,https://github.com/apache/arrow,15008,Apache Arrow is the universal columnar format and multi-language toolbox for fast data interchange and in-memory analytics,Apache License 2.0,0,0,0,2016-02-17
microsoft/onnxruntime,https://github.com/microsoft/onnxruntime,15641,"ONNX Runtime: cross-platform, high performance ML inferencing and training accelerator",The MIT License,0,0,0,2018-11-10
spotify/annoy,https://github.com/spotify/annoy,13499,Approximate Nearest Neighbors in C++/Python optimized for memory usage and loading/saving to disk,Apache License 2.0,0,0,0,2013-04-01
rui314/mold,https://github.com/rui314/mold,14847,Mold: A Modern Linker 🦠,The MIT License,0,0,0,2020-09-29
TheCherno/Hazel,https://github.com/TheCherno/Hazel,11951,Hazel Engine,Apache License 2.0,0,0,0,2018-10-20
facebook/watchman,https://github.com/facebook/watchman,12927,"Watches files and records, or triggers actions, when they change. ",The MIT License,0,0,0,2012-11-29
webview/webview,https://github.com/webview/webview,12887,Tiny cross-platform webview library for C/C++. Uses WebKit (GTK/Cocoa) and Edge WebView2 (Windows).,The MIT License,0,0,0,2017-08-19
microsoft/BitNet,https://github.com/microsoft/BitNet,12738,Official inference framework for 1-bit LLMs,The MIT License,0,0,0,2024-08-05
sogou/workflow,https://github.com/sogou/workflow,13508,C++ Parallel Computing and Asynchronous Networking Framework,Apache License 2.0,0,0,0,2020-07-29
SFML/SFML,https://github.com/SFML/SFML,10642,Simple and Fast Multimedia Library,Zlib/libpng License,0,0,0,2011-03-25
apache/thrift,https://github.com/apache/thrift,10638,Apache Thrift,Apache License 2.0,0,0,0,2009-09-18
google/or-tools,https://github.com/google/or-tools,11626,Google's Operations Research tools:,Apache License 2.0,0,0,0,2015-02-21
gzc/CLRS,https://github.com/gzc/CLRS,9528,:notebook:Solutions to Introduction to Algorithms,The MIT License,0,0,0,2013-12-03
opencv/opencv_contrib,https://github.com/opencv/opencv_contrib,9554,Repository for OpenCV's extra modules,Apache License 2.0,0,0,0,2013-09-11
organicmaps/organicmaps,https://github.com/organicmaps/organicmaps,10547,"🍃 Organic Maps is a free Android & iOS offline maps app for travelers, tourists, hikers, and cyclists. It uses crowd-sourced OpenStreetMap data and is developed with love by the community. No ads, no tracking, no data collection, no crapware. Please donate to support the development!",Apache License 2.0,0,0,0,2020-12-27
android/ndk-samples,https://github.com/android/ndk-samples,10188,Android NDK samples with Android Studio,Apache License 2.0,0,0,0,2015-05-16
ange-yaghi/engine-sim,https://github.com/ange-yaghi/engine-sim,8776,Combustion engine simulator that generates realistic audio.,The MIT License,0,0,0,2021-12-18
baldurk/renderdoc,https://github.com/baldurk/renderdoc,9352,RenderDoc is a stand-alone graphics debugging tool.,The MIT License,0,0,0,2014-02-27
BYVoid/OpenCC,https://github.com/BYVoid/OpenCC,8730,Conversion between Traditional and Simplified Chinese,Apache License 2.0,0,0,0,2010-07-15
sass/node-sass,https://github.com/sass/node-sass,8506,:rainbow: Node.js bindings to libsass,The MIT License,0,0,0,2012-04-24
