name,url,stars,description,license,question_issues,help_wanted_issues,total_issues,community_score,created_at
TS-KargoTakip/KargoTakip.Server,https://github.com/TS-KargoTakip/KargoTakip.Server,25,Kargo takip projesinin backend reposu,The MIT License,0,0,0,0,2025-02-08
MPowerKit/GoogleMaps,https://github.com/MPowerKit/GoogleMaps,24,"Google Maps SDK library for .NET MAUI. Allows to interact with map in MVVM manner through bindings or with map control directly. Includes such features as Pins, Circles, Polylines, Polygons, Ground overlays, Tiles, Clusters, Heat maps, KML, GeoJSON.",The MIT License,0,0,0,0,2024-11-27
iomoath/FileWatchTower,https://github.com/iomoath/FileWatchTower,24,FWT is a security analysis and file monitoring tool that utilizes Sysmon events.,Apache License 2.0,0,0,0,0,2024-07-11
deyordanov/SoftUni-Training,https://github.com/deyordanov/SoftUni-Training,24,,The MIT License,0,0,0,0,2024-07-06
KristofferStrube/Blazor.MediaStreamRecording,https://github.com/KristofferStrube/Blazor.MediaStreamRecording,24,A Blazor wrapper for the MediaStream Recording browser API.,The MIT License,0,0,0,0,2024-08-18
codewriter-packages/TMP-Image,https://github.com/codewriter-packages/TMP-Image,24,Script for drawing sprite from Text Mesh Pro atlases in UGUI,The MIT License,0,0,0,0,2024-10-20
Voyonic-Systems/Echoes,https://github.com/Voyonic-Systems/Echoes,24,Simple type safe translations for Avalonia,The MIT License,0,0,0,0,2024-10-10
luisllamasbinaburo/DeepSeek-NET,https://github.com/luisllamasbinaburo/DeepSeek-NET,24,A modern .NET (C#) wrapper for the DeepSeek AI API,The MIT License,0,0,0,0,2025-01-22
loresoft/Equatable.Generator,https://github.com/loresoft/Equatable.Generator,23,Source generator for Equals and GetHashCode with attribute based control of equality implementation,The MIT License,0,0,0,0,2024-08-29
whoeevee/ivinject,https://github.com/whoeevee/ivinject,23,The most demure iOS app injector and signer,The MIT License,0,0,0,0,2024-11-03
kfdf/fake-doom,https://github.com/kfdf/fake-doom,23,Doom software renderer,The MIT License,0,0,0,0,2024-08-10
PassiveModding/atompds,https://github.com/PassiveModding/atompds,23,An atproto PDS implementation in .NET (C#),The MIT License,0,0,0,0,2024-12-14
awesome-excel/awesome-excel,https://github.com/awesome-excel/awesome-excel,23,,The MIT License,0,0,0,0,2024-07-13
thisisnabi/Bible,https://github.com/thisisnabi/Bible,23,YARP API Gateway in ASP.NET Core,The MIT License,0,0,0,0,2024-07-04
DinoChiesa/dotnetzip-2025,https://github.com/DinoChiesa/dotnetzip-2025,23,Updated DotNetZip that builds with current .NET,Apache License 2.0,0,0,0,0,2025-01-19
VeryJokerJal/Alpha,https://github.com/VeryJokerJal/Alpha,23,,The MIT License,0,0,0,0,2025-01-16
engineering87/dotnet-design-patterns,https://github.com/engineering87/dotnet-design-patterns,23,GoF Design Patterns implemented in .NET C#,The MIT License,0,0,0,0,2024-08-12
mattwar/Linq2Span,https://github.com/mattwar/Linq2Span,23,LINQ implementation for Span,Apache License 2.0,0,0,0,0,2024-09-26
amoerie/fluentassertions-migrator,https://github.com/amoerie/fluentassertions-migrator,23,Migrates FluentAssertions to standard xunit assertions,The MIT License,0,0,0,0,2025-01-23
NotNite/SPRXPatcher,https://github.com/NotNite/SPRXPatcher,23,A modern PlayStation 3 ELF patcher to load SPRX files,The MIT License,0,0,0,0,2024-08-11
aniketrajnish/PixelPerfectShadowCaster2D-Unity,https://github.com/aniketrajnish/PixelPerfectShadowCaster2D-Unity,23,Pixel Perfect Shadow Caster (2D) for Unity,The MIT License,0,0,0,0,2025-01-28
afrise/MCPSharp,https://github.com/afrise/MCPSharp,22,MCPSharp is a .NET library that helps you build Model Context Protocol (MCP) servers - the standardized API protocol used by AI assistants and models.,The MIT License,0,0,0,0,2025-02-17
qian-o/AvalonDock.Themes.WPFUI,https://github.com/qian-o/AvalonDock.Themes.WPFUI,22,Based on WPFUI theme library for AvalonDock.,The MIT License,0,0,0,0,2024-12-13
scottdurow/magical-mystery-tour,https://github.com/scottdurow/magical-mystery-tour,22,"The Contoso Real Estate (Power Platform Edition) project is an adaptation of the Azure Sample 'Contoso Real Estate'. This project demonstrates how to develop, deploy, test, and manage a real estate management solution using Power Platform, Azure, and GitHub.",The MIT License,0,0,0,0,2024-09-15
questfulcat/SolidModelBrowser,https://github.com/questfulcat/SolidModelBrowser,22,"Viewer and converter for STL, 3MF, OBJ, PLY, GCODE files",The MIT License,0,0,0,0,2024-10-17
pimbrouwers/Danom,https://github.com/pimbrouwers/Danom,22,Structures for durable programming patterns in C#.,Apache License 2.0,0,0,0,0,2024-08-11
alexanderameye/stencil-debugger,https://github.com/alexanderameye/stencil-debugger,22,,The MIT License,0,0,0,0,2025-02-19
oskardudycz/kandddinsky2024,https://github.com/oskardudycz/kandddinsky2024,22,,The MIT License,0,0,0,0,2024-10-26
MrVeit/Veittech-UnigramPayment,https://github.com/MrVeit/Veittech-UnigramPayment,22,A library for making payments inside web applications made on Unity using a new internal currency - Telegram Stars.,The MIT License,0,0,0,0,2024-07-14
KubaZ2/Sharp,https://github.com/KubaZ2/Sharp,21,"Sharp is a powerful Discord bot that runs, decompiles, and shows JIT disassembly of .NET languages. With .NET 9 support!",The MIT License,0,0,0,0,2024-08-09
Anwar-alhitar/Deepseek.Asp.Client,https://github.com/Anwar-alhitar/Deepseek.Asp.Client,21,,The MIT License,0,0,0,0,2025-01-29
TORISOUP/VoicevoxClientSharp,https://github.com/TORISOUP/VoicevoxClientSharp,21,,The MIT License,0,0,0,0,2024-11-07
yazilimacademy/YazilimAcademyPayments,https://github.com/yazilimacademy/YazilimAcademyPayments,21,This is the yazilim academy payments project from the livestreams for PAYTR payments provider.,The MIT License,0,0,0,0,2024-12-14
kwan3854/Unity-NOPE,https://github.com/kwan3854/Unity-NOPE,21,The fastest functional programming library for Unity – the easiest and quickest way to handle exceptions and null values.,The MIT License,0,0,0,0,2025-01-26
AIDotNet/Markdown.AIRender,https://github.com/AIDotNet/Markdown.AIRender,21,,The MIT License,0,0,0,0,2024-12-27
syncfusion/essential-ui-kit-for-.net-maui,https://github.com/syncfusion/essential-ui-kit-for-.net-maui,21,Free and beautiful XAML template pages for .NET MAUI apps.,The MIT License,0,0,0,0,2024-12-02
kteong1012/LubanEditor,https://github.com/kteong1012/LubanEditor,21,Luban较为通用的编辑器工具,The MIT License,0,0,0,0,2024-08-26
xboxoneresearch/Interop,https://github.com/xboxoneresearch/Interop,21,Xbox SystemOS specific interop code,The MIT License,0,0,0,0,2024-07-06
phanphantz/GameDevSecretSauce,https://github.com/phanphantz/GameDevSecretSauce,21,,The MIT License,0,0,0,0,2024-07-31
buraksenyurt/ProgrammingWithCSharp,https://github.com/buraksenyurt/ProgrammingWithCSharp,21,İstanbul Teknik Üniversitesi Matematik Mühendisliği bölümü için açılmlış olan C# ile Nesne Yönelimli Programlamanın Temelleri konulu ders notlarını ve örnek kodları içeren repodur.,The MIT License,0,0,0,0,2024-10-14
zvasya/Istok,https://github.com/zvasya/Istok,21,Cross-platform open-source C# Game Engine,The MIT License,0,0,0,0,2024-09-16
marcominerva/TwoFactorAuthenticationSample,https://github.com/marcominerva/TwoFactorAuthenticationSample,21,A sample that showcases how to implement Two-Factor authentication in a Web API using an external Authenticator app,The MIT License,0,0,0,0,2024-09-02
russkyc/russkyc-ui-avalonia,https://github.com/russkyc/russkyc-ui-avalonia,21,"Clean, beautifully-designed, and customizable components for Avalonia applications.",The MIT License,0,0,0,0,2024-12-27
CCEMT/Emilia-NodeEditor,https://github.com/CCEMT/Emilia-NodeEditor,20,Unity 纯编辑器实现的节点编辑器框架,The MIT License,0,0,0,0,2024-12-23
mrange/AvaloniaOpenGlTest,https://github.com/mrange/AvaloniaOpenGlTest,20,Tinkering with Avalonia+OpenGL,Creative Commons 1.0 Universal,0,0,0,0,2024-07-06
alinaduca/BachelorsThesis-UnityLab,https://github.com/alinaduca/BachelorsThesis-UnityLab,20,"Chemistry laboratory in Virtual Reality, made with Unity and Blender. Bachelor's thesis, year 2024. Keywords: VR, chemistry-lab, chemistry-models, experiments, chatbot, reactions",The MIT License,0,0,0,0,2024-07-12
DevTeam/csharp-interactive,https://github.com/DevTeam/csharp-interactive,20, Build automation system for .NET,The MIT License,0,0,0,0,2024-07-18
franny1615/MAUI.Bootstrap,https://github.com/franny1615/MAUI.Bootstrap,20,.NET MAUI Version of Bootstrap web components.,The MIT License,0,0,0,0,2024-09-21
erievs/mangotube,https://github.com/erievs/mangotube,20,A YouTube cleint for Windows Mobile 8.1 powered by invidious. ,The MIT License,0,0,0,0,2024-08-24
Njabulo240/InventorySystem,https://github.com/Njabulo240/InventorySystem,20,"An advanced Inventory Management System for managing IT assets, providing features such as inventory tracking, user management, reports and analytics, asset management, maintenance schedules, and device status reporting.",The MIT License,0,0,0,0,2024-07-09
SketchNow/SketchNow.WPF,https://github.com/SketchNow/SketchNow.WPF,20,An application brings the ability to draw on your screen,The MIT License,0,0,0,0,2024-10-11
taublast/ShadersCarousel,https://github.com/taublast/ShadersCarousel,19,DrawnUI and SKSL shaders are used to construct a custom Carousel control for .NET MAUI. SkiaSharp version 3 made this possible.,The MIT License,0,0,0,0,2024-11-09
NatVanG/PBI-InspectorV2,https://github.com/NatVanG/PBI-InspectorV2,19,A rules-based Power BI report layout testing tool.,The MIT License,0,0,0,0,2024-07-11
pabloFuente/livekit-server-sdk-dotnet,https://github.com/pabloFuente/livekit-server-sdk-dotnet,19,".NET APIs to manage LiveKit Rooms, Access Tokens, Egress, Ingress, SIP and Agents. This library is designed to work with livekit-server. Use it with a .NET backend to manage access to LiveKit.",Apache License 2.0,0,0,0,0,2024-11-08
MorizeroDev/Minity,https://github.com/MorizeroDev/Minity,19,"A Unity extension framework that includes features such as object pooling, scene routing, UI manager, binding view, and behavior trees.",Apache License 2.0,0,0,0,0,2024-09-21
m-jovanovic/service-discovery-consul,https://github.com/m-jovanovic/service-discovery-consul,19,Service discovery demo in .NET using Consul as a service registry.,The MIT License,0,0,0,0,2024-07-03
iONLY100/WeChatFerry.WinForm,https://github.com/iONLY100/WeChatFerry.WinForm,19,WeChatFerry 的 C# WinForm 客户端,The MIT License,0,0,0,0,2024-07-29
GregFinzer/Blazor8Auth,https://github.com/GregFinzer/Blazor8Auth,19,,The MIT License,0,0,0,0,2024-07-24
daohainam/lets-learn-aspnet,https://github.com/daohainam/lets-learn-aspnet,19,,The MIT License,0,0,0,0,2024-08-14
cristipufu/tunnelite,https://github.com/cristipufu/tunnelite,19,"TCP, HTTP and WS tunneling in .NET with SignalR",The MIT License,0,0,0,0,2024-07-08
MarkCiliaVincenti/Backport.System.Threading.Lock,https://github.com/MarkCiliaVincenti/Backport.System.Threading.Lock,19,"A micro-library that backports/polyfills .NET 9.0+'s System.Threading.Lock to prior versions (from .NET Standard 2.0 up to .NET 8.0), providing as much similar functionality as possible. Optionally works as a source generator.",The MIT License,0,0,0,0,2024-08-11
DaZombieKiller/JitInspector,https://github.com/DaZombieKiller/JitInspector,19,JIT codegen inspector for Unity,The MIT License,0,0,0,0,2024-08-03
Hiro420/BinaryVersionReconstructor,https://github.com/Hiro420/BinaryVersionReconstructor,18,A minimal BinaryVersion.bytes parser && reconstructor for some anime game with stars and rails,The MIT License,0,0,0,0,2024-10-26
TanerSaydam/YB1,https://github.com/TanerSaydam/YB1,18,,The MIT License,0,0,0,0,2024-08-06
Hiro420/HSR_Downloader,https://github.com/Hiro420/HSR_Downloader,18,Asb/DesignData/Lua downloader from hotfix.json for some anime game with stars and rails,The MIT License,0,0,0,0,2024-10-20
drwellss/MultronFguardian,https://github.com/drwellss/MultronFguardian,18,Multron File Guardian - A File Encrypter/Decrypter With Many Encryption Algorithm,The MIT License,0,0,0,0,2024-09-24
AIDotNet/Gnarly,https://github.com/AIDotNet/Gnarly,18,,The MIT License,0,0,0,0,2024-10-21
rliberoff/dotnet-ai-community-standup-sk-whats-new-and-cool-demo,https://github.com/rliberoff/dotnet-ai-community-standup-sk-whats-new-and-cool-demo,18,,The MIT License,0,0,0,0,2024-12-17
Riniba/TelegramMonitor,https://github.com/Riniba/TelegramMonitor,18,Telegram监听关键词｜TG抓需求｜实时监测频道｜telegram关键词监控｜电报｜tg关键词监控｜telegram监控机器人｜主动获取｜消息订阅｜telegram消息监控｜tg自动发送消息｜telegram群消息接收｜关键词报警｜多群监控｜自动化群管理｜telegram数据分析 Telegram Keyword Listening | TG Demand Capture | Real-Time Channel Monitoring | Telegram Keyword Monitoring | Telegram | TG Keyword Monitoring | Telegram Monitoring Bot | Active Retrieval | Subscription ,Apache License 2.0,0,0,0,0,2024-12-17
autodesk-platform-services/aps-hubs-bulk-files-manager,https://github.com/autodesk-platform-services/aps-hubs-bulk-files-manager,18,"This is a desktop based application for uploading/downloading the files between the local machine and the folders of Autodesk BIM 360, Autodesk Construction Cloud(ACC), Autodesk BIM360 Teams etc.",The MIT License,0,0,0,0,2024-07-17
rasulhsn/Database-Archiver,https://github.com/rasulhsn/Database-Archiver,18,Simple tool for transfering/Archiving data between databases.,The MIT License,0,0,0,0,2025-01-08
NLick47/Taix,https://github.com/NLick47/Taix,18, 👻 Track software usage time and website browsing duration. 统计软件使用时长和网站浏览时长,The MIT License,0,0,0,0,2024-11-08
hai-vr/h-view,https://github.com/hai-vr/h-view,18,"Haï~'s personal OSC Query debugger and ImGui.NET VR development playground. Shows all OSC addresses and the Expressions Menu. Also runs ImGui as a SteamVR overlay. Demo: https://x.com/vr_hai/status/1828145014574325902 To generate the Expressions Menu, open the site:",The MIT License,0,0,0,0,2024-08-26
jmuozan/AI_3D_Models_Grasshopper,https://github.com/jmuozan/AI_3D_Models_Grasshopper,17,Set of AI Tools to generate breps inside Grasshopper with Rhino 8,The MIT License,0,0,0,0,2024-08-08
acced/BeginnerGuide,https://github.com/acced/BeginnerGuide,17,Unity新手引导,The MIT License,0,0,0,0,2025-01-29
adsstudio24/task_automator,https://github.com/adsstudio24/task_automator,17,,The MIT License,0,0,0,0,2025-02-01
LostBeard/SpawnDev.BlazorJS.WebWorkers,https://github.com/LostBeard/SpawnDev.BlazorJS.WebWorkers,17,Easily call Services in separate threads with WebWorkers and SharedWebWorkers. Run Blazor WASM in the ServiceWorker.,The MIT License,0,0,0,0,2024-07-22
adsstudio24/virus_scanner,https://github.com/adsstudio24/virus_scanner,17,,The MIT License,0,0,0,0,2025-02-01
POPCORNBOOM/EZHolodotNet,https://github.com/POPCORNBOOM/EZHolodotNet,17,an easy way to create Abrasion/Scratch/Hightlight Holography from 2D images/pictures;轻易从平面图像/照片创建刮擦全息路径,Apache License 2.0,0,0,0,0,2024-12-24
kapellos/VladimiRED,https://github.com/kapellos/VladimiRED,17,,The MIT License,0,0,0,0,2024-12-18
PederHP/mcpdotnet,https://github.com/PederHP/mcpdotnet,17,.NET implementation of the Model Context Protocol (MCP),The MIT License,0,0,0,0,2024-12-30
russkyc/responsive-avalonia,https://github.com/russkyc/responsive-avalonia,17,Responsive breakpoints for AvaloniaUI,The MIT License,0,0,0,0,2024-10-10
csharpfritz/AspireAntivirus,https://github.com/csharpfritz/AspireAntivirus,17,Proof of concept showing how to add ClamAV antivirus detection to a .NET Aspire application,The MIT License,0,0,0,0,2024-07-08
Higgins-PT/HigWaterSystem2,https://github.com/Higgins-PT/HigWaterSystem2,17,"Hig Water System 2.0 is an advanced, user-friendly, and realistic ocean surface rendering solution focused on simulating lifelike visuals. It provides real-time, realistic ocean surface simulations through physics-based oceanographic empirical formulas combined with reflection and refraction using the HZB algorithm. ",Apache License 2.0,0,0,0,0,2024-12-04
seniordev1012/dotnet-Azure-AI-botsharp,https://github.com/seniordev1012/dotnet-Azure-AI-botsharp,17,,Apache License 2.0,0,0,0,0,2024-10-03
jaccck15/Spoofer-Hwid-Game,https://github.com/jaccck15/Spoofer-Hwid-Game,17,"This custom-created Hardware ID Spoofer is designed to bypass hardware or IP bans, allowing users to regain access to restricted platforms. It effectively changes the unique identifiers of a device, ensuring anonymity and continued usage despite previous bans.",The MIT License,0,0,0,0,2024-09-09
esnya/ResoniteMetricsCounter,https://github.com/esnya/ResoniteMetricsCounter,17,"This mod provides a simple performance metrics counter for Resonite, useful for world optimisation.",The MIT License,0,0,0,0,2024-12-12
adsstudio24/telegram_bot,https://github.com/adsstudio24/telegram_bot,17,,The MIT License,0,0,0,0,2025-02-01
swharden/SwarmFit,https://github.com/swharden/SwarmFit,17,A .NET package for fitting curves to data using particle swarm optimization,The MIT License,0,0,0,0,2024-08-14
yn01-dev/TypeScriptImporter,https://github.com/yn01-dev/TypeScriptImporter,17,TypeScript Importer for Unity,The MIT License,0,0,0,0,2025-01-11
davidortinau/Plugin.Maui.DebugOverlay,https://github.com/davidortinau/Plugin.Maui.DebugOverlay,17,,The MIT License,0,0,0,0,2024-07-27
oising/AspireProjectCommander,https://github.com/oising/AspireProjectCommander,17,Allows sending custom commands to projects from the AppHost dashboard,The MIT License,0,0,0,0,2024-12-19
AlbertZhaoz/tuling-gk,https://github.com/AlbertZhaoz/tuling-gk,16,图灵工控一期课程配套代码，课程涵盖编程基本功+工业协议+Winform+Wpf+工业互联+智能化黑灯工厂项目（基于最新的 .NET8），毕业从小白到年薪 30-40 万，完全是自己走过的路，亲身实践。,The MIT License,0,0,0,0,2024-09-20
LSXPrime/LibLoader,https://github.com/LSXPrime/LibLoader,16,"Cross-platform native library loader for .NET, simplifying the process of loading and interacting with native libraries (DLLs, SOs, dylibs) in your C# applications.  It supports dependency management, flexible loading options (local files, embedded resources, remote URLs), and provides a clean, fluent API for configuration and function calling.",The MIT License,0,0,0,0,2024-11-07
DulajHansana/Simple-Calculator,https://github.com/DulajHansana/Simple-Calculator,16,Simple calculator with arithmetic operations which developed in C++,Apache License 2.0,0,0,0,0,2024-08-16
MarkPryceMaherMSFT/OpenMirroring,https://github.com/MarkPryceMaherMSFT/OpenMirroring,16,Project for open sources demos for Excel Mirroring using Open Mirroing,The MIT License,0,0,0,0,2024-11-29
stevsharp/BlazorGrpcApp,https://github.com/stevsharp/BlazorGrpcApp,16,,The MIT License,0,0,0,0,2024-07-29
DavidVeksler/CodeContext,https://github.com/DavidVeksler/CodeContext,16,Outputs a codebase to text for an LLM to see its context,The MIT License,0,0,0,0,2024-08-07
DaZombieKiller/FatePackageManager,https://github.com/DaZombieKiller/FatePackageManager,16,Extract and repack FPD packages from Fate/stay night REMASTERED,The MIT License,0,0,0,0,2024-08-08
heemskerkerik/htmello,https://github.com/heemskerkerik/htmello,16,"A sample application in htmx, replicating functionality from Trellix",The MIT License,0,0,0,0,2024-07-18
Ming-jiayou/AvaloniaChat,https://github.com/Ming-jiayou/AvaloniaChat,16,A simple application using a large language model for translation.,Apache License 2.0,0,0,0,0,2024-08-16
mehmetozkaya/EshopModularMonoliths-Sections,https://github.com/mehmetozkaya/EshopModularMonoliths-Sections,16,EshopModularMonoliths-Sections,The MIT License,0,0,0,0,2024-08-12
deepglint/dgxr-integration-sdk,https://github.com/deepglint/dgxr-integration-sdk,16,"unity sdk for rendering, tracking, input, interaction, mixed reality, platform services ",The MIT License,0,0,0,0,2024-07-08
atomatiq/SchemaMigrations,https://github.com/atomatiq/SchemaMigrations,16,Custom tool to simplify working with schemas,The MIT License,0,0,0,0,2024-10-11
SolicenTEAM/UEExtractor,https://github.com/SolicenTEAM/UEExtractor,16,Extracts .locres from Unreal Engine unpacked: .pak or .utoc to localize the game.,The MIT License,0,0,0,0,2024-08-05
xiangyongjun/GreenHat,https://github.com/xiangyongjun/GreenHat,16,绿帽子保护您的电脑安全,The MIT License,0,0,0,0,2025-01-29
oculus-samples/Unity-NorthStar,https://github.com/oculus-samples/Unity-NorthStar,15,"North Star is a VR showcase for Unity, demonstrating cutting-edge graphics and immersive gameplay on Meta Quest devices. Join a crew of pirates on a quest for mythic treasure, and uncover the secrets of creating exceptional visuals on Quest devices. This project showcases hand tracking, Interaction SDK, Movement SDK, and Application Spacewarp.",The MIT License,0,0,0,0,2024-12-21
Azure-Samples/resource-inventory-gateway,https://github.com/Azure-Samples/resource-inventory-gateway,15,"A .NET-based gateway for managing and aggregating Azure resource data and costs, providing streamlined interaction with Azure Resource Manager (ARM) APIs and Azure Cost APIs.",The MIT License,0,0,0,0,2024-09-09
Carl-Frellett/JBAPI,https://github.com/Carl-Frellett/JBAPI,15,JBAPI  YES！,The MIT License,0,0,0,0,2024-08-18
stevsharp/StatePattern,https://github.com/stevsharp/StatePattern,15,,Apache License 2.0,0,0,0,0,2024-07-05
gok11/UNote,https://github.com/gok11/UNote,15,A tool for taking notes in Unity.,The MIT License,0,0,0,0,2024-09-15
sselecirPyM/Godot-MMD,https://github.com/sselecirPyM/Godot-MMD,15,Godot MMD Plugin with .NET,The MIT License,0,0,0,0,2024-08-09
nitish-kaushik/aspnetcore-webapi-clean-architecture,https://github.com/nitish-kaushik/aspnetcore-webapi-clean-architecture,15,,The MIT License,0,0,0,0,2024-07-09
xaio6/Digital_Human_UI,https://github.com/xaio6/Digital_Human_UI,15,数字人授课录制系统——全新的微课视频的生成方案——UI,The MIT License,0,0,0,0,2024-09-12
matthewrdev/mfractor,https://github.com/matthewrdev/mfractor,15,"The source code for MFractor, a legacy productivity tool for .NET MAUI for Visual Studio Windows and Mac.",The MIT License,0,0,0,0,2024-07-30
paulmooreparks/Xfer,https://github.com/paulmooreparks/Xfer,15,An experimental data-transfer language.,The MIT License,0,0,0,0,2024-10-22
gus33000/MobilePackageGen,https://github.com/gus33000/MobilePackageGen,15,Tools to generate packages for mobile windows platforms out of commodity dumps or backups or drives or ffus,The MIT License,0,0,0,0,2024-09-02
OlivierGuillaume/ProceduralGeometry,https://github.com/OlivierGuillaume/ProceduralGeometry,15,A C# mesh manipulation library for Unity,The MIT License,0,0,0,0,2025-01-10
DmitryMuravyev/Delta-Compression,https://github.com/DmitryMuravyev/Delta-Compression,15,Simple and lightweight compressor/decompressor for microcontrollers.,The MIT License,0,0,0,0,2024-08-17
encse/adventofcode-template,https://github.com/encse/adventofcode-template,15,C#/.Net template for adventofcode,The MIT License,0,0,0,0,2024-10-23
MayDay-wpf/SearchForYou,https://github.com/MayDay-wpf/SearchForYou,15,A networked search website based on LLM AI（一个基于LLM AI的网络搜索网站）,Apache License 2.0,0,0,0,0,2024-11-21
lalakii/WINtp,https://github.com/lalakii/WINtp,15,【WINtp】适用于Windows系统的NTP时间同步小工具，更加快速的时间同步实现。https://wintp.sourceforge.io/,Apache License 2.0,0,0,0,0,2024-11-04
thatplatypus/BlazorCodeEditor,https://github.com/thatplatypus/BlazorCodeEditor,15,A fully client side c# code editor with blazor and roslyn,The MIT License,0,0,0,0,2024-12-02
Hiro420/StaticCmdIdDumper,https://github.com/Hiro420/StaticCmdIdDumper,15,A very minimal CmdId dumper for a certain anime game,The MIT License,0,0,0,0,2024-09-03
hijimasa/ros2-tools-to-use-unity-like-gazebo,https://github.com/hijimasa/ros2-tools-to-use-unity-like-gazebo,15,This repository shows how to control the robot from ros2_control to make Unity easier to use.,Apache License 2.0,0,0,0,0,2024-11-01
nipunasahanmahaliyana/APIRateLimit,https://github.com/nipunasahanmahaliyana/APIRateLimit,15,"Rate limiting is useful to protect your application from abuse, overloading, or misuse.",The MIT License,0,0,0,0,2024-12-31
fizkultprivet322/fingerprint-tcp-generator,https://github.com/fizkultprivet322/fingerprint-tcp-generator,14,,The MIT License,0,0,0,0,2024-12-02
dead-folk/planar-reflections,https://github.com/dead-folk/planar-reflections,14,Planar reflections for Unity's Universal Render Pipeline.,The MIT License,0,0,0,0,2024-08-25
LyttleG/FluentDictionary,https://github.com/LyttleG/FluentDictionary,14,"A fluent wrapper around Dictionary<TKey, TValue>, providing additional functionality for serialization and fluent creation.",The MIT License,0,0,0,0,2025-01-30
umeshkamble/SocialMediaLoginWithMAUI,https://github.com/umeshkamble/SocialMediaLoginWithMAUI,14,,The MIT License,0,0,0,0,2024-12-28
renatogroffe/OpenTelemetry-Grafana_DevOpsExperience-2024-08,https://github.com/renatogroffe/OpenTelemetry-Grafana_DevOpsExperience-2024-08,14,Conteúdos sobre OpenTelemetry + Grafana de apresentação realizada durante a edição de Agosto-2024 do DevOps Experience.,The MIT License,0,0,0,0,2024-08-28
kolebynov/Dusharp,https://github.com/kolebynov/Dusharp,14,Source generator for discriminated unions in C#,The MIT License,0,0,0,0,2024-09-11
coderbusy/luyao-avalonia,https://github.com/coderbusy/luyao-avalonia,14,,The MIT License,0,0,0,0,2024-10-17
