name,url,stars,description,license,question_issues,help_wanted_issues,total_issues,community_score,created_at
CommunityToolkit/Aspire,https://github.com/CommunityToolkit/Aspire,316,A community project with additional components and extensions for .NET Aspire,The MIT License,1,22,34,23,2024-07-04
Ryubing/Ryujinx,https://github.com/Ryubing/Ryujinx,7986,"Nintendo Switch emulator written in C#, originally created by gdkchan.",The MIT License,0,15,179,15,2024-10-06
KisaragiEffective/ResoniteImportHelper,https://github.com/KisaragiEffective/ResoniteImportHelper,24,"Convert Unity avatar into glTF, then import to Resonite",The MIT License,3,5,50,8,2024-08-28
tonybaloney/CSnakes,https://github.com/tonybaloney/CSnakes,431,Embed Python in .NET,The MIT License,1,6,71,7,2024-07-18
FritzAndFriends/SharpSite,https://github.com/FritzAndFriends/SharpSite,114,A basic CMS built with .NET 9 and Blazor,The MIT License,2,4,59,6,2024-10-10
bazyleu/UniState,https://github.com/bazyleu/UniState,113,"UniState is a modern, high-performance, scalable state machine package for Unity.",The MIT License,1,4,5,5,2024-07-18
p3nGu1nZz/Tau,https://github.com/p3nGu1nZz/Tau,14,Tau LLM made with Unity 6 ML Agents,The MIT License,0,5,4,5,2024-08-24
edwardgushchin/SDL3-CS,https://github.com/edwardgushchin/SDL3-CS,18,"This is SDL3#, a C# wrapper for SDL3.",Zlib/libpng License,2,3,0,5,2024-07-06
jeroenwalter/SdcpMonitor,https://github.com/jeroenwalter/SdcpMonitor,15,Application for monitoring the print progress of the Elegoo Saturn 4 Ultra via the SDCP protocol,The MIT License,2,2,18,4,2024-07-29
netcorepal/d3shop,https://github.com/netcorepal/d3shop,92,An online shop project based on Domain-Driven Design,The MIT License,0,3,29,3,2024-09-09
MidraLab/uDesktopMascot,https://github.com/MidraLab/uDesktopMascot,256,desktop mascot open project,Apache License 2.0,2,1,9,3,2025-01-11
RadicalCSG/com.chisel,https://github.com/RadicalCSG/com.chisel,47,"Chisel CSG Level Editor, for Unity",The MIT License,0,3,8,3,2024-09-20
kiapanahi/Aspire.ResourceServer.Standalone,https://github.com/kiapanahi/Aspire.ResourceServer.Standalone,19,A standalone .NET Aspire Resource Server implementation,The MIT License,1,2,7,3,2024-10-30
DrMeepso/WebFishingCove,https://github.com/DrMeepso/WebFishingCove,91,A dedicated server for Webfishing!,Apache License 2.0,0,3,3,3,2024-11-03
AkiKurisu/Ceres,https://github.com/AkiKurisu/Ceres,41,Powerful visual scripting toolkit for Unity. Inspired from Unreal's Blueprint.,The MIT License,0,3,3,3,2024-12-29
PinchToDebug/Pihole-Tray,https://github.com/PinchToDebug/Pihole-Tray,43,A tray application for Pi-hole,The MIT License,1,2,0,3,2024-08-22
neelabo/NeeView,https://github.com/neelabo/NeeView,103,An image viewer that allows you to browse images in folders and compressed files like a book. Powerful customization is available.,The MIT License,2,0,216,2,2025-01-15
microsoft/ai-dev-gallery,https://github.com/microsoft/ai-dev-gallery,830,An open-source project for Windows developers to learn how to add AI with local models and APIs to Windows apps.,The MIT License,0,2,50,2,2024-11-06
IviriusCommunity/Rebound,https://github.com/IviriusCommunity/Rebound,494,Windows 11 done right.,The MIT License,0,2,43,2,2024-08-08
Azure/azure-service-bus-emulator-installer,https://github.com/Azure/azure-service-bus-emulator-installer,175,"This repository acts as a central hub for handling issues, collecting feedback, and facilitating discussions related to the Azure Service Bus Emulator.",The MIT License,2,0,27,2,2024-11-04
ArturWyszomirski/Plugin.Maui.Chat,https://github.com/ArturWyszomirski/Plugin.Maui.Chat,27,Highly customizable chat control,The MIT License,1,1,25,2,2024-07-09
microsoft/Agents-for-net,https://github.com/microsoft/Agents-for-net,56,This repository is for active development of the Microsoft 365 Agent SDK components for .NET,The MIT License,1,1,16,2,2024-11-06
Kromtec/LegendsViewer-Next,https://github.com/Kromtec/LegendsViewer-Next,79,Recreates Dwarf Fortress' Legends Mode from exported files.,The MIT License,1,1,12,2,2024-09-24
jiaozi158/UnitySSGIURP,https://github.com/jiaozi158/UnitySSGIURP,225,Screen Space Global Illumination for Unity URP (Universal Render Pipeline).,The MIT License,2,0,9,2,2024-07-11
NotNite/GDWeave,https://github.com/NotNite/GDWeave,168,Mod loader & runtime script patching for Godot,The MIT License,0,2,6,2,2024-10-16
ld0614/DPC,https://github.com/ld0614/DPC,20,The new home for DPC,The MIT License,2,0,6,2,2024-10-08
martincostello/openapi-extensions,https://github.com/martincostello/openapi-extensions,61,Extensions for Microsoft.AspNetCore.OpenApi,Apache License 2.0,0,2,4,2,2024-07-28
roblox-csharp/roblox-cs,https://github.com/roblox-csharp/roblox-cs,56,C# to Luau transpiler for Roblox,The MIT License,0,2,4,2,2024-07-08
sakakun/Proxmox-Desktop-Client,https://github.com/sakakun/Proxmox-Desktop-Client,125,A windows desktop client for Proxmox.,The MIT License,2,0,1,2,2024-11-20
builtbybel/Flyby11,https://github.com/builtbybel/Flyby11,1049,Windows 11 Upgrading Assistant,The MIT License,0,1,30,1,2024-10-19
YusufOzmen01/desktopmate-custom-avatar-loader,https://github.com/YusufOzmen01/desktopmate-custom-avatar-loader,506,Custom Avatar Loader Mod for DesktopMate!,The MIT License,0,1,19,1,2025-01-09
PCJones/MediathekArr,https://github.com/PCJones/MediathekArr,106,"Integrate ARD&ZDF Mediathek in Prowlarr, Sonarr and Radarr",The MIT License,1,0,12,1,2024-10-22
devlooped/StructId,https://github.com/devlooped/StructId,34,Automatic implemention of stronly typed IDs via record structs with compile-time feature auto-detection,The MIT License,1,0,11,1,2024-11-19
Os-Derivados/college-management,https://github.com/Os-Derivados/college-management,24,CLI application for managing University internal assets,The MIT License,1,0,10,1,2024-07-29
NikiforovAll/dependify,https://github.com/NikiforovAll/dependify,65,Explore project dependencies in .NET,The MIT License,0,1,4,1,2024-07-18
alexmalyutindev/unity-urp-radiance-cascades,https://github.com/alexmalyutindev/unity-urp-radiance-cascades,103,Alexander Sannikov's Radiance Cascades for Unity's URP,The MIT License,1,0,2,1,2024-11-23
ghost1372/DevWinUI,https://github.com/ghost1372/DevWinUI,55,"DevWinUI is a collection of useful classes, controls, styles, and codes for WinUI 3. Create a WinUI 3 app in less than a minute with the built-in project templates and scaffolding tools.  ",The MIT License,1,0,2,1,2024-11-18
michaelmsonne/SignToolGUI,https://github.com/michaelmsonne/SignToolGUI,46,"This tool is a user-friendly Graphical User Interface (GUI) tool that simplifies and streamlines the process of digitally signing files using Microsoft's signtool.exe. This tool is designed to provide a straightforward interface, enabling users to apply digital signatures to software executables, drivers, DLLs, and other file types effortlessly.",The MIT License,0,1,2,1,2024-07-18
hfiref0x/WinDepends,https://github.com/hfiref0x/WinDepends,511,Windows Dependencies,The MIT License,0,1,1,1,2024-11-23
AIDotNet/GraphRag.Net,https://github.com/AIDotNet/GraphRag.Net,210,参考GraphRag使用 Semantic Kernel 来实现的dotnet版本，可以使用NuGet开箱即用集成到项目中,Apache License 2.0,1,0,1,1,2024-07-22
SaboZhang/EasyTidy,https://github.com/SaboZhang/EasyTidy,151,EasyTidy A simple file auto-classification tool  makes it easy to create automatic workflows with files. / EasyTidy 一个简单的文件自动分类整理工具  轻松创建文件的自动工作流程,The MIT License,1,0,1,1,2024-09-18
VahidN/DntSite,https://github.com/VahidN/DntSite,87,این پروژه، سورس کامل و در حال استفاده‌ی وب‌سایت «دات‌نت تيپس» است,Apache License 2.0,1,0,1,1,2024-07-25
ktxiaok/FireAxe,https://github.com/ktxiaok/FireAxe,45,"A Left 4 Dead 2 addon manager that supports hierarchical organization, workshop items and collections download, addon enablement management, etc.",Apache License 2.0,1,0,1,1,2024-10-27
AbZorbaGames/artificetoolkit,https://github.com/AbZorbaGames/artificetoolkit,76,A Unity toolkit that allows easy editor customization with simple C# attributes.,Apache License 2.0,1,0,0,1,2024-11-20
yazilimacademy/akilliprompt-backend,https://github.com/yazilimacademy/akilliprompt-backend,33,Yazilim Academy'nin Akilli Prompt projesi,The MIT License,0,1,0,1,2024-11-20
amp64/openphonos,https://github.com/amp64/openphonos,24,Full featured Sonos stack and applications,The MIT License,0,1,0,1,2024-10-04
endatix/endatix,https://github.com/endatix/endatix,17,Endatix is the open-source data collection and management library for .NET,The MIT License,0,0,126,0,2024-07-29
cloudyExecutor/cxapi,https://github.com/cloudyExecutor/cxapi,18,Custom Xeno Api,The MIT License,0,0,101,0,2025-02-08
ryujinx-mirror/ryujinx,https://github.com/ryujinx-mirror/ryujinx,2383,Hard-fork of the Ryujinx project,The MIT License,0,0,48,0,2024-10-01
microsoft/Agents,https://github.com/microsoft/Agents,115,"The Microsoft 365 Agent SDK simplifies building full stack, multichannel, trusted agents for platforms including M365, Teams, Copilot Studio, and Webchat.",The MIT License,0,0,39,0,2024-11-04
microsoft/Document-Knowledge-Mining-Solution-Accelerator,https://github.com/microsoft/Document-Knowledge-Mining-Solution-Accelerator,69,"Solution accelerator built on Azure OpenAI Service and Azure AI Document Intelligence to process and extract summaries, entities, and metadata from unstructured, multi-modal documents and enable searching and chatting over this data.",The MIT License,0,0,38,0,2024-09-19
Webreaper/SolisAgileManager,https://github.com/Webreaper/SolisAgileManager,17,Solis Inverter Manager for Octopus Agile Tariffs,The MIT License,0,0,31,0,2025-01-08
yn01-dev/Lua-CSharp,https://github.com/yn01-dev/Lua-CSharp,303,High performance Lua interpreter implemented in C# for .NET and Unity,The MIT License,0,0,29,0,2024-09-20
FireCubeStudios/DarkSky,https://github.com/FireCubeStudios/DarkSky,195,BlueSky client for Windows 10/11,The MIT License,0,0,29,0,2024-11-12
DuendeSoftware/foss,https://github.com/DuendeSoftware/foss,50,Duende's Free and Open Source software.,Apache License 2.0,0,0,27,0,2024-10-04
dotnet/xcsync,https://github.com/dotnet/xcsync,22,xcsync is designed to provide .NET developers with improved support for editing Apple specific files for MAUI and .NET for iOS/tvOS/macOS/macCatalyst projects.,The MIT License,0,0,27,0,2024-08-08
marinasundstrom/CheckedExceptions,https://github.com/marinasundstrom/CheckedExceptions,16,Enforce better exception handling in C#/.NET by ensuring exceptions are explicitly handled.,The MIT License,0,0,23,0,2024-11-12
StarKRE22/Atomic,https://github.com/StarKRE22/Atomic,34,Architectural framework for developing games in C# and Unity,The MIT License,0,0,22,0,2024-08-13
RiversideValley/Toolkit,https://github.com/RiversideValley/Toolkit,16,The ultimate toolkit for building modern apps.,The MIT License,0,0,22,0,2024-10-11
Delt06/aaaa-rp,https://github.com/Delt06/aaaa-rp,46,🌟 A Scriptable Render Pipeline (SRP) featuring modern high fidelity rendering techniques.,The MIT License,0,0,19,0,2024-07-07
specklesystems/speckle-sharp-connectors,https://github.com/specklesystems/speckle-sharp-connectors,30,Speckle Connectors V3,Apache License 2.0,0,0,19,0,2024-07-04
esdg/GodotSceneManager,https://github.com/esdg/GodotSceneManager,22,The Scene Manager plugin enhances your Godot development workflow by providing a visual graph editor for managing transitions between scenes.,The MIT License,0,0,18,0,2024-07-12
jenius-apps/beeskie,https://github.com/jenius-apps/beeskie,95,A Windows app for Bluesky,The MIT License,0,0,16,0,2024-11-14
syncfusion/maui-toolkit,https://github.com/syncfusion/maui-toolkit,328,"Syncfusion Toolkit for .NET MAUI offers high-quality UI controls to help you build rich, high-performance applications for iOS, Android, macOS, and Windows from a single codebase",The MIT License,0,0,14,0,2024-10-03
publicrust/rust-analyzer,https://github.com/publicrust/rust-analyzer,17,,The MIT License,0,0,14,0,2024-11-27
BAndysc/AvaloniaVisualBasic6,https://github.com/BAndysc/AvaloniaVisualBasic6,1370,A recreation of the classic Visual Basic 6 IDE and language in C# with Avalonia,The MIT License,0,0,12,0,2024-11-07
SakiRinn/LiveCaptions-Translator,https://github.com/SakiRinn/LiveCaptions-Translator,226,A real-time speech translation tool based on Windows LiveCaptions.,The MIT License,0,0,12,0,2024-09-13
VedalAI/neuro-game-sdk,https://github.com/VedalAI/neuro-game-sdk,210,Neuro Game API + SDK for allowing Neuro to play games,The MIT License,0,0,12,0,2024-12-04
friflo/Friflo.Engine.ECS,https://github.com/friflo/Friflo.Engine.ECS,253,High-performance C# ECS,The MIT License,0,0,11,0,2024-07-24
SharpLogic/LightNap,https://github.com/SharpLogic/LightNap,72,LightNap (lightweight .NET/Angular/PrimeNG) is a full stack starter kit designed to provide a boost to Single Page Applications (SPA).,The MIT License,0,0,11,0,2024-10-11
DevOpsVisions/question2answer-automation-toolkit,https://github.com/DevOpsVisions/question2answer-automation-toolkit,22,Question2Answer Automation Toolkit,The MIT License,0,0,11,0,2024-07-29
Dotnetflare/dotnetflare,https://github.com/Dotnetflare/dotnetflare,16,Dotnet Flare is an extensive open-source repository designed to cover the entire world of C# and .NET programming.,The MIT License,0,0,11,0,2024-10-14
dragonloverlord/RyujinxBackup,https://github.com/dragonloverlord/RyujinxBackup,15,,The MIT License,0,0,11,0,2024-10-01
AwesomeAssertions/AwesomeAssertions,https://github.com/AwesomeAssertions/AwesomeAssertions,497,A fork of FluentAssertions controlled by the community.,Apache License 2.0,0,0,10,0,2025-01-14
mohammadKarimi/Riter,https://github.com/mohammadKarimi/Riter,215,"Riter is not a pen, it's your mind.",The MIT License,0,0,10,0,2024-08-23
LittleLittleCloud/StepWise,https://github.com/LittleLittleCloud/StepWise,107,"A C# framework to build, visualize and execute event-driven workflow",The MIT License,0,0,10,0,2024-09-10
Vertex-Form-3D/vertexform3d-unity-vr-starterkit,https://github.com/Vertex-Form-3D/vertexform3d-unity-vr-starterkit,67,Open Source unity vr multiplayer framework,The MIT License,0,0,10,0,2025-01-18
thomasgalliker/CameraScanner.Maui,https://github.com/thomasgalliker/CameraScanner.Maui,48,Camera preview and barcode scanner for .NET MAUI apps,The MIT License,0,0,9,0,2024-07-03
FlorianButz/DynamicWin,https://github.com/FlorianButz/DynamicWin,152,A Dynamic Island inspired app for Windows machines. ,Creative Commons Attribution Share Alike 4.0 International,0,0,8,0,2024-07-28
AArnott/Nerdbank.MessagePack,https://github.com/AArnott/Nerdbank.MessagePack,74,A .NET MessagePack serialization library with great performance and simplicity.,The MIT License,0,0,8,0,2024-10-27
microsoft/micronaire,https://github.com/microsoft/micronaire,49,A RAG evaluation pipeline for Semantic Kernel,The MIT License,0,0,8,0,2024-09-27
dcronqvist/DotTiled,https://github.com/dcronqvist/DotTiled,32,📚 A .NET library for loading Tiled maps and tilesets,The MIT License,0,0,8,0,2024-07-21
spotflow-io/in-memory-azure-test-sdk,https://github.com/spotflow-io/in-memory-azure-test-sdk,29,"Drop-in fakes of Azure .NET SDKs to make your tests runnable locally, without real infrastructure, blazing-fast and reliable.",The MIT License,0,0,8,0,2024-08-09
sousou63/DarkRP,https://github.com/sousou63/DarkRP,22,S&Box roleplay gamemode,The MIT License,0,0,8,0,2024-08-07
NimblePros/Metronome,https://github.com/NimblePros/Metronome,19,A simple tool for tracking Database and Http calls per ASP.NET Core request.,The MIT License,0,0,8,0,2024-12-18
vbandi/RxAI,https://github.com/vbandi/RxAI,19,The RX.Net Way to AI,The MIT License,0,0,8,0,2024-10-11
friflo/friflo-ecs-unity,https://github.com/friflo/friflo-ecs-unity,17,friflo ECS · Unity C# extension package,The MIT License,0,0,8,0,2024-09-04
Space-Kobold/Alpha-Paradox,https://github.com/Space-Kobold/Alpha-Paradox,16,,The MIT License,0,0,8,0,2024-12-19
WPFDevelopersOrg/XNode,https://github.com/WPFDevelopersOrg/XNode,172,可视化程序编辑器，类似虚幻引擎的蓝图。A visual programming editor similar to Unreal Engine's Blueprint.,The MIT License,0,0,7,0,2024-08-04
Drommedhar/DlssUpdater,https://github.com/Drommedhar/DlssUpdater,138,"DlssUpdater is a tool to conveniently configure all 3 instances of DLSS libraries (Upscaling, Ray Reconstruction, Frame Generation) used by your games.",The MIT License,0,0,7,0,2024-09-24
Azure-Samples/gen-ai-bot-in-a-box,https://github.com/Azure-Samples/gen-ai-bot-in-a-box,54,This template deploys a Generative AI Virtual Assistant using Azure OpenAI and Bot Framework.,The MIT License,0,0,7,0,2024-08-02
glutzer/SneedSmoother,https://github.com/glutzer/SneedSmoother,30,,The MIT License,0,0,7,0,2024-07-26
BAndysc/Classic.Avalonia,https://github.com/BAndysc/Classic.Avalonia,230,Classic Theme and Controls for Avalonia,The MIT License,0,0,6,0,2024-10-15
Project-GagSpeak/client,https://github.com/Project-GagSpeak/client,29,Cordelia's Passion Project in it's Final Form. A project for all BDSM Enjoyers to have as a free tool for fun and enjoyment. ♥,Apache License 2.0,0,0,6,0,2024-11-23
hpavlo/Rememory,https://github.com/hpavlo/Rememory,24,Rememory | Clipboard Manager,The MIT License,0,0,6,0,2024-12-15
Darkdriller/PowerToys-Run-LocalLLm,https://github.com/Darkdriller/PowerToys-Run-LocalLLm,16,use Local LLM on PowerToys Run,The MIT License,0,0,6,0,2024-08-19
builtbybel/SuperMSConfig,https://github.com/builtbybel/SuperMSConfig,375,MSConfig of our dreams...,The MIT License,0,0,5,0,2024-08-31
sdcb/chats,https://github.com/sdcb/chats,255,Flexible frontend for managing and deploying language models.,Apache License 2.0,0,0,5,0,2024-11-11
LSXPrime/SoundFlow,https://github.com/LSXPrime/SoundFlow,162,"A powerful and extensible cross-platform .NET audio engine. provides comprehensive audio processing capabilities including playback, recording, effects, analysis, and visualization, built with a modular and high-performance architecture.",The MIT License,0,0,5,0,2025-02-08
microsoft/profile-explorer,https://github.com/microsoft/profile-explorer,136,CPU profiling trace viewer,The MIT License,0,0,5,0,2024-08-13
Hona/VerticalSliceArchitecture,https://github.com/Hona/VerticalSliceArchitecture,88,"Spend less time over-engineering, and more time coding. The template has a focus on convenience, and developer confidence. Vertical Slice Architecture 🎈",The MIT License,0,0,5,0,2024-07-13
aws/integrations-on-dotnet-aspire-for-aws,https://github.com/aws/integrations-on-dotnet-aspire-for-aws,61,This repositry contains the integrations with .NET Aspire for AWS.,MIT No Attribution,0,0,5,0,2024-11-01
yuto-trd/ReDocking,https://github.com/yuto-trd/ReDocking,56,Docking UI library for Avalonia like JetBrains IDEs.,The MIT License,0,0,5,0,2024-08-19
madskristensen/SqlFormatter,https://github.com/madskristensen/SqlFormatter,38,,Apache License 2.0,0,0,5,0,2024-08-09
kwan3854/TextMeshProMax,https://github.com/kwan3854/TextMeshProMax,26,The ultimate Unity Text Mesh Pro helper package.,The MIT License,0,0,5,0,2024-11-30
emako/wpfui.violeta,https://github.com/emako/wpfui.violeta,26,"WPF UI Violeta is based on WPF UI, and provides the Fluent experience in your known and loved WPF framework.",The MIT License,0,0,5,0,2024-08-13
lilxyzw/lilEditorToolbox,https://github.com/lilxyzw/lilEditorToolbox,18,,The MIT License,0,0,5,0,2024-08-17
chrisg32/AvaloniaPdfViewer,https://github.com/chrisg32/AvaloniaPdfViewer,16,A customizable control for viewing PDFs using Avalonia UI.,The MIT License,0,0,5,0,2024-07-29
dennisdoomen/reflectify,https://github.com/dennisdoomen/reflectify,63,Simple source only reflection library with default interface property support,The MIT License,0,0,4,0,2024-10-20
ninjamode/Unity-VR-Gaussian-Splatting,https://github.com/ninjamode/Unity-VR-Gaussian-Splatting,56,VR-capable version of Gaussian Splatting for Unity,The MIT License,0,0,4,0,2024-10-31
UnicordDev/UniSky,https://github.com/UnicordDev/UniSky,56,"A BlueSky client for Windows 11, Windows 10 and Windows 10 Mobile",The MIT License,0,0,4,0,2024-10-26
CyberAgentGameEntertainment/BuildMagic,https://github.com/CyberAgentGameEntertainment/BuildMagic,44,An utility to manage multiple build schemes such as development and release for Unity.,The MIT License,0,0,4,0,2024-11-28
NeverMorewd/Lemon.ModuleNavigation,https://github.com/NeverMorewd/Lemon.ModuleNavigation,36,"A lightweight module navigation framework built on top of the Microsoft Dependency Injection (MSDI) for AvaloniaUI, WPF and .net-xaml-platforms else. Support nativeAot",The MIT License,0,0,4,0,2024-09-27
cnbluefire/MiDropShellExtForWindows11,https://github.com/cnbluefire/MiDropShellExtForWindows11,31,Windows11版小米电脑管家右键菜单,The MIT License,0,0,4,0,2024-11-14
teutinsa/Helldivers2ModManager,https://github.com/teutinsa/Helldivers2ModManager,28,A Helldivers 2 Mod Manager,Apache License 2.0,0,0,4,0,2024-09-23
NotNite/WebfishingPlus,https://github.com/NotNite/WebfishingPlus,23,Mods for WEBFISHING,The MIT License,0,0,4,0,2024-10-20
Lyall/TalesOfGracesFFix,https://github.com/Lyall/TalesOfGracesFFix,21,A BepInEx plugin for Tales of Graces f Remastered that aims to add ultrawide/narrower support and more.,The MIT License,0,0,4,0,2025-01-18
emako/TiktokLiveRec,https://github.com/emako/TiktokLiveRec,18,Douyin/Tiktok Live Recorder with GUI | 抖音录播无人值守立即上手,The MIT License,0,0,4,0,2024-10-21
unifiedfx/UFX.Relay,https://github.com/unifiedfx/UFX.Relay,18,,The MIT License,0,0,4,0,2024-07-26
Lyall/PoPTLCFix,https://github.com/Lyall/PoPTLCFix,16,"A BepInEx plugin for Prince of Persia: The Lost Crown that adds custom resolutions, ultrawide/narrower support and more.",The MIT License,0,0,4,0,2024-08-17
Ylianst/HTCommander,https://github.com/Ylianst/HTCommander,15,"HAM Radio control tool for the UV-Pro, GA-5WB, VR-N76, VR-N7500 radios. Allows for easy control over your radio and APRS messaging.",Apache License 2.0,0,0,4,0,2025-01-19
hassanhabib/EventHighway,https://github.com/hassanhabib/EventHighway,14,Standard-Compliant Event Pub/Sub Management Library,The MIT License,0,0,4,0,2024-11-02
microsoft/Generative-AI-for-beginners-dotnet,https://github.com/microsoft/Generative-AI-for-beginners-dotnet,293,"Five lessons, learn how to really apply AI to your .NET Applications",The MIT License,0,0,3,0,2025-01-10
danpdc/cleanArchitectureTemplate,https://github.com/danpdc/cleanArchitectureTemplate,179,,The MIT License,0,0,3,0,2024-09-15
PavlikBender/ScreTran,https://github.com/PavlikBender/ScreTran,153,"Простой экранный переводчик, screen translator",The MIT License,0,0,3,0,2024-07-14
suncloudsmoon/TextCraft,https://github.com/suncloudsmoon/TextCraft,116,Integrates AI tools into Microsoft Word,The MIT License,0,0,3,0,2024-09-02
JDKaim/HuskySwap,https://github.com/JDKaim/HuskySwap,80,HuskySwap Project.,The MIT License,0,0,3,0,2024-10-03
IntptrMax/YoloSharp,https://github.com/IntptrMax/YoloSharp,74,Train Yolo with C#,Apache License 2.0,0,0,3,0,2024-10-28
stbychkov/AutoLoggerMessage,https://github.com/stbychkov/AutoLoggerMessage,70,A source generator that automatically migrates your logging calls to the LoggerMessage version,The MIT License,0,0,3,0,2024-11-27
akpaevj/onec-debug-adapter,https://github.com/akpaevj/onec-debug-adapter,55,,The MIT License,0,0,3,0,2024-10-07
RonenNess/Iguina,https://github.com/RonenNess/Iguina,36,"Iguina is a framework-agnostic, cross platform, modern UI system for C#.",The MIT License,0,0,3,0,2024-07-14
MackinnonBuck/blazor-js-components,https://github.com/MackinnonBuck/blazor-js-components,34,,The MIT License,0,0,3,0,2024-10-03
spectreconsole/examples,https://github.com/spectreconsole/examples,31,Contains examples for the Spectre.Console library.,The MIT License,0,0,3,0,2024-08-05
Zgoly/MultiBloxy,https://github.com/Zgoly/MultiBloxy,27,MultiBloxy is a Windows application designed to manage and control multiple Roblox instances efficiently. It provides a convenient way to open multiple instances for different accounts and offers various options to manage them directly from the system tray.,The MIT License,0,0,3,0,2024-10-31
sakasakiking/FusionX,https://github.com/sakasakiking/FusionX,27,Theme for Playnite Desktop Mode,The MIT License,0,0,3,0,2024-08-22
MarcellVokk/aio-launcher,https://github.com/MarcellVokk/aio-launcher,26,,The MIT License,0,0,3,0,2024-08-31
HartsyAI/SwarmUI-MagicPromptExtension,https://github.com/HartsyAI/SwarmUI-MagicPromptExtension,23,,The MIT License,0,0,3,0,2024-08-18
CppCXY/LanguageServer.Framework,https://github.com/CppCXY/LanguageServer.Framework,23,Supports the latest Language Server Protocol and AOT (Ahead-of-Time) compilation.,The MIT License,0,0,3,0,2024-07-11
CppCXY/LanguageServer.Framework,https://github.com/CppCXY/LanguageServer.Framework,23,Supports the latest Language Server Protocol and AOT (Ahead-of-Time) compilation.,The MIT License,0,0,3,0,2024-07-11
microsoft/AzDevOpsDemoGenerator,https://github.com/microsoft/AzDevOpsDemoGenerator,23,"Azure DevOps Demo Generator helps teams create projects on their Team Services account with pre-populated sample content that includes source code, work items, iterations, service endpoints, build and release definitions based on a chosen template",The MIT License,0,0,3,0,2024-11-20
ZGGSONG/LangIndicator,https://github.com/ZGGSONG/LangIndicator,23,Windows平台的输入法中英文切换指示器,The MIT License,0,0,3,0,2024-11-28
eviltwo/InputGlyphs,https://github.com/eviltwo/InputGlyphs,22,Displays glyphs (icons) of keyboard & mouse or controller buttons detected by Unity's InputSystem.,The MIT License,0,0,3,0,2024-07-04
Azure-Samples/netaivideoanalyzer,https://github.com/Azure-Samples/netaivideoanalyzer,19,"This repository contains a series of samples on how to analyse a video using multimodal Large Language Models, like GPT-4o or GPT-4o-mini.",The MIT License,0,0,3,0,2024-11-05
